{
  "task_name": "example-local-dashboard",
  "workdir": "/abs/path/to/your/project",
  "verify_status": "fail",
  "fail_kind": "test_fail",
  "fail_summary": "npm test failed: ...",
  "commands": [
    {
      "cmd": "npm test",
      "exit_code": 1,
      "stdout_tail": "...",
      "stderr_tail": "..."
    }
  ],
  "artifacts": {
    "verify_json": "/abs/path/to/your/project/.openclaw-runs/<run_id>/verify.json",
    "verify_report": "/abs/path/to/your/project/.openclaw-runs/<run_id>/verify-report.txt"
  }
}
